{
  "schema_version": "internal.verified_outcome.v1",
  "verified_outcome_id": "outcome_btc_001",
  "publication_decision_id": "publication_btc_001",
  "outcome_status": "open",
  "resolved_at": "2026-06-19T17:00:00Z",
  "learning": {
    "claim_result": "unknown",
    "decision_quality": "pending_resolution",
    "notes": "Open fixture proves lineage only."
  },
  "lineage": {
    "claim_packet_id": "claim_btc_momentum_extended_001",
    "evidence_bundle_id": "evidence_btc_momentum_extended_001",
    "publication_decision_id": "publication_btc_001"
  }
}
